{
  "basisdaten": {
    "id": "sv-elversberg",
    "slug": "sv-elversberg",
    "name": "SV Elversberg",
    "short_name": "SVE",
    "sport": "fussball",
    "country": "deutschland",
    "league": "zweite-bundesliga",
    "city": "Spiesen-Elversberg",
    "federal_state": "Saarland",
    "stadium_name": "URSAPHARM-Arena an der Kaiserlinde",
    "stadium_location": "Lindenstraße 5, 66583 Spiesen-Elversberg",
    "stadium_capacity": 10000,
    "primary_colors_text": "Schwarz, Weiß"
  },
  "offizielle_quellen": [
    {
      "url": "https://sv07elversberg.de",
      "name": "Offizielle Website",
      "category": "official",
      "source_type": "official-club-site",
      "trust_level": "official",
      "notes": null
    },
    {
      "url": "https://shop.sv07elversberg.de",
      "name": "SVE Fanshop",
      "category": "official",
      "source_type": "official-fanshop",
      "trust_level": "official",
      "notes": null
    },
    {
      "url": "https://www.instagram.com/svelversberg",
      "name": "Instagram",
      "category": "official",
      "source_type": "official-social",
      "trust_level": "official",
      "notes": null
    }
  ],
  "inoffizielle_quellen": [
    {
      "url": "https://www.transfermarkt.de/sv-elversberg/forum/verein/1352",
      "name": "Transfermarkt SVE Forum",
      "category": "fan",
      "source_type": "fan-forum",
      "trust_level": "unofficial",
      "notes": "Primäre Fan-Community"
    }
  ],
  "daten_nachschlagen": [
    {
      "url": "https://www.transfermarkt.de/sv-elversberg/startseite/verein/1352",
      "name": "Transfermarkt Profil",
      "category": "stats",
      "source_type": "transfer-data",
      "trust_level": "trusted-third-party",
      "notes": null
    }
  ],
  "medien_berichterstattung": [
    {
      "url": "https://www.saarbruecker-zeitung.de/sport/sz-sport/sv-elversberg",
      "name": "Saarbrücker Zeitung (SVE)",
      "category": "media",
      "source_type": "local-media",
      "trust_level": "trusted-third-party",
      "notes": null
    }
  ],
  "stadion_matchday": [
    {
      "url": "https://sv07elversberg.de/stadion/anreise",
      "name": "Anreise Kaiserlinde",
      "category": "stadium",
      "source_type": "travel-info",
      "trust_level": "official",
      "notes": null
    }
  ],
  "metadaten": {
    "last_checked": "2026-04-09T03:00:00Z",
    "confidence": 1.0,
    "notes": "Daten für Batch 2 aktualisiert.",
    "missing_fields": [],
    "update_priority": "medium"
  }
}