{
  "basisdaten": {
    "id": "vfb-stuttgart",
    "slug": "vfb-stuttgart",
    "name": "VfB Stuttgart",
    "short_name": "VfB",
    "sport": "fussball",
    "country": "deutschland",
    "league": "bundesliga",
    "city": "Stuttgart",
    "federal_state": "Baden-Württemberg",
    "stadium_name": "MHP Arena",
    "stadium_location": "Mercedesstraße 87, 70372 Stuttgart",
    "stadium_capacity": 60058,
    "primary_colors_text": "Weiß, Rot"
  },
  "offizielle_quellen": [
    {
      "url": "https://www.vfb.de",
      "name": "Offizielle Website",
      "category": "official",
      "source_type": "official-club-site",
      "trust_level": "official",
      "notes": null
    },
    {
      "url": "https://shop.vfb.de",
      "name": "Fanshop",
      "category": "official",
      "source_type": "official-fanshop",
      "trust_level": "official",
      "notes": null
    },
    {
      "url": "https://www.instagram.com/vfb",
      "name": "Instagram",
      "category": "official",
      "source_type": "official-social",
      "trust_level": "official",
      "notes": null
    }
  ],
  "inoffizielle_quellen": [
    {
      "url": "https://www.brustring-forum.de",
      "name": "Brustring-Forum",
      "category": "fan",
      "source_type": "fan-forum",
      "trust_level": "unofficial",
      "notes": "Fan-Community"
    }
  ],
  "daten_nachschlagen": [
    {
      "url": "https://www.transfermarkt.de/vfb-stuttgart/startseite/verein/79",
      "name": "Transfermarkt Profil",
      "category": "stats",
      "source_type": "transfer-data",
      "trust_level": "trusted-third-party",
      "notes": null
    }
  ],
  "medien_berichterstattung": [
    {
      "url": "https://www.swr.de/sport/fussball/vfb-stuttgart/index.html",
      "name": "SWR Sport (VfB)",
      "category": "media",
      "source_type": "local-media",
      "trust_level": "trusted-third-party",
      "notes": null
    }
  ],
  "stadion_matchday": [
    {
      "url": "https://www.mhparena-stuttgart.de/besucher/anreise",
      "name": "Anreise MHP Arena",
      "category": "stadium",
      "source_type": "travel-info",
      "trust_level": "official",
      "notes": null
    }
  ],
  "metadaten": {
    "last_checked": "2026-04-09T02:23:00Z",
    "confidence": 1,
    "notes": "Daten für Batch 1 aktualisiert.",
    "missing_fields": [],
    "update_priority": "medium"
  }
}