{
  "basisdaten": {
    "id": "karlsruher-sc",
    "slug": "karlsruher-sc",
    "name": "Karlsruher SC",
    "short_name": "KSC",
    "sport": "fussball",
    "country": "deutschland",
    "league": "zweite-bundesliga",
    "city": "Karlsruhe",
    "federal_state": "Baden-Württemberg",
    "stadium_name": "BBBank Wildpark",
    "stadium_location": "Adenauerring 17, 76131 Karlsruhe",
    "stadium_capacity": 34302,
    "primary_colors_text": "Blau, Weiß"
  },
  "offizielle_quellen": [
    {
      "url": "https://www.ksc.de",
      "name": "Offizielle Website",
      "category": "official",
      "source_type": "official-club-site",
      "trust_level": "official",
      "notes": null
    },
    {
      "url": "https://ksc.de/shop",
      "name": "KSC Onlineshop",
      "category": "official",
      "source_type": "official-fanshop",
      "trust_level": "official",
      "notes": null
    },
    {
      "url": "https://www.instagram.com/karlsruhersc",
      "name": "Instagram",
      "category": "official",
      "source_type": "official-social",
      "trust_level": "official",
      "notes": null
    }
  ],
  "inoffizielle_quellen": [
    {
      "url": "https://www.google.com/search?q=Fanforum+Karlsruher%20SC",
      "name": "Fan-Forum (Suche)",
      "category": "fan",
      "source_type": "fan-forum",
      "trust_level": "unofficial",
      "notes": "Zentrales Fan-Forum"
    }
  ],
  "daten_nachschlagen": [
    {
      "url": "https://www.transfermarkt.de/karlsruher-sc/startseite/verein/48",
      "name": "Transfermarkt Profil",
      "category": "stats",
      "source_type": "transfer-data",
      "trust_level": "trusted-third-party",
      "notes": null
    }
  ],
  "medien_berichterstattung": [
    {
      "url": "https://www.bnn.de/sport/ksc",
      "name": "BNN (Karlsruher SC)",
      "category": "media",
      "source_type": "local-media",
      "trust_level": "trusted-third-party",
      "notes": null
    }
  ],
  "stadion_matchday": [
    {
      "url": "https://www.google.com/maps/search/?api=1&query=BBBank%20Wildpark",
      "name": "Anfahrt (Google Maps)",
      "category": "stadium",
      "source_type": "travel-info",
      "trust_level": "official",
      "notes": null
    }
  ],
  "metadaten": {
    "last_checked": "2026-04-09T02:35:00Z",
    "confidence": 1,
    "notes": "Daten für Batch 2 aktualisiert.",
    "missing_fields": [],
    "update_priority": "medium"
  }
}