{
    "basisdaten": {
      "id": "hertha-bsc",
      "slug": "hertha-bsc",
      "name": "Hertha BSC",
      "short_name": "Hertha",
      "sport": "fussball",
      "country": "deutschland",
      "league": "zweite-bundesliga",
      "city": "Berlin",
      "federal_state": "Berlin",
      "stadium_name": "Olympiastadion Berlin",
      "stadium_location": "Olympischer Platz 3, 14053 Berlin",
      "stadium_capacity": 74475,
      "primary_colors_text": "Blau, Weiß"
    },
    "offizielle_quellen": [
      {
        "url": "https://www.herthabsc.com",
        "name": "Offizielle Website",
        "category": "official",
        "source_type": "official-club-site",
        "trust_level": "official",
        "notes": null
      },
      {
        "url": "https://shop.herthabsc.com",
        "name": "Hertha Fanshop",
        "category": "official",
        "source_type": "official-fanshop",
        "trust_level": "official",
        "notes": null
      },
      {
        "url": "https://www.instagram.com/herthabsc",
        "name": "Instagram",
        "category": "official",
        "source_type": "official-social",
        "trust_level": "official",
        "notes": null
      }
    ],
    "inoffizielle_quellen": [
      {
        "url": "https://www.herthabscuk.wordpress.com",
        "name": "Hertha BSC UK",
        "category": "fan",
        "source_type": "fan-blog",
        "trust_level": "unofficial",
        "notes": "Internationaler Fan-Blog"
      }
    ],
    "daten_nachschlagen": [
      {
        "url": "https://www.transfermarkt.de/hertha-bsc/startseite/verein/44",
        "name": "Transfermarkt Profil",
        "category": "stats",
        "source_type": "transfer-data",
        "trust_level": "trusted-third-party",
        "notes": null
      }
    ],
    "medien_berichterstattung": [
      {
        "url": "https://www.tagesspiegel.de/sport/hertha-bsc",
        "name": "Tagesspiegel (Hertha)",
        "category": "media",
        "source_type": "local-media",
        "trust_level": "trusted-third-party",
        "notes": null
      }
    ],
    "stadion_matchday": [
      {
        "url": "https://www.herthabsc.com/de/stadion/anreise",
        "name": "Anreise Olympiastadion",
        "category": "stadium",
        "source_type": "travel-info",
        "trust_level": "official",
        "notes": null
      }
    ],
    "metadaten": {
      "last_checked": "2026-04-09T02:33:00Z",
      "confidence": 1.0,
      "notes": "Daten für Batch 2 aktualisiert.",
      "missing_fields": [],
      "update_priority": "medium"
    }
}