{
  "basisdaten": {
    "id": "borussia-dortmund",
    "slug": "borussia-dortmund",
    "name": "Borussia Dortmund",
    "short_name": "BVB",
    "sport": "fussball",
    "country": "deutschland",
    "league": "bundesliga",
    "city": "Dortmund",
    "federal_state": "Nordrhein-Westfalen",
    "stadium_name": "Signal Iduna Park",
    "stadium_location": "Strobelallee 50, 44139 Dortmund",
    "stadium_capacity": 81365,
    "primary_colors_text": "Schwarz, Gelb"
  },
  "offizielle_quellen": [
    {
      "url": "https://www.bvb.de",
      "name": "Offizielle Website",
      "category": "official",
      "source_type": "official-club-site",
      "trust_level": "official",
      "notes": null
    },
    {
      "url": "https://shop.bvb.de",
      "name": "BVB Fanshop",
      "category": "official",
      "source_type": "official-fanshop",
      "trust_level": "official",
      "notes": null
    },
    {
      "url": "https://www.youtube.com/@BVB",
      "name": "YouTube",
      "category": "official",
      "source_type": "official-youtube",
      "trust_level": "official",
      "notes": null
    },
    {
      "url": "https://www.instagram.com/bvb09",
      "name": "Instagram",
      "category": "official",
      "source_type": "official-social",
      "trust_level": "official",
      "notes": null
    }
  ],
  "inoffizielle_quellen": [
    {
      "url": "https://www.schwatzgelb.de",
      "name": "Schwatzgelb.de",
      "category": "fan",
      "source_type": "fan-community",
      "trust_level": "unofficial",
      "notes": "Fanzine und Community"
    },
    {
      "url": "https://bvbbuzz.com",
      "name": "BVB Buzz",
      "category": "fan",
      "source_type": "fan-blog",
      "trust_level": "unofficial",
      "notes": "Englischsprachige News"
    }
  ],
  "daten_nachschlagen": [
    {
      "url": "https://www.transfermarkt.de/borussia-dortmund/startseite/verein/16",
      "name": "Transfermarkt Profil",
      "category": "stats",
      "source_type": "transfer-data",
      "trust_level": "trusted-third-party",
      "notes": null
    }
  ],
  "medien_berichterstattung": [
    {
      "url": "https://www.ruhrnachrichten.de/bvb",
      "name": "Ruhr Nachrichten (BVB)",
      "category": "media",
      "source_type": "local-media",
      "trust_level": "trusted-third-party",
      "notes": null
    }
  ],
  "stadion_matchday": [
    {
      "url": "https://www.bvb.de/de/de/signal-iduna-park/anfahrt.html",
      "name": "Stadion Anreise",
      "category": "stadium",
      "source_type": "travel-info",
      "trust_level": "official",
      "notes": null
    }
  ],
  "metadaten": {
    "last_checked": "2026-04-09T02:18:00Z",
    "confidence": 1.0,
    "notes": "Daten für Batch 1 aktualisiert.",
    "missing_fields": [],
    "update_priority": "medium"
  }
}