{
    "basisdaten": {
      "id": "1-fc-nuernberg",
      "slug": "1-fc-nuernberg",
      "name": "1. FC Nürnberg",
      "short_name": "Der Club",
      "sport": "fussball",
      "country": "deutschland",
      "league": "zweite-bundesliga",
      "city": "Nürnberg",
      "federal_state": "Bayern",
      "stadium_name": "Max-Morlock-Stadion",
      "stadium_location": "Max-Morlock-Platz 1, 90471 Nürnberg",
      "stadium_capacity": 50000,
      "primary_colors_text": "Weinrot, Weiß"
    },
    "offizielle_quellen": [
      {
        "url": "https://www.fcn.de",
        "name": "Offizielle Website",
        "category": "official",
        "source_type": "official-club-site",
        "trust_level": "official",
        "notes": null
      },
      {
        "url": "https://www.fcn-shop.de",
        "name": "FCN Fanshop",
        "category": "official",
        "source_type": "official-fanshop",
        "trust_level": "official",
        "notes": null
      },
      {
        "url": "https://www.instagram.com/1_fc_nuernberg",
        "name": "Instagram",
        "category": "official",
        "source_type": "official-social",
        "trust_level": "official",
        "notes": null
      }
    ],
    "inoffizielle_quellen": [
      {
        "url": "https://www.clubfans-reunited.de",
        "name": "Clubfans Reunited",
        "category": "fan",
        "source_type": "fan-magazine",
        "trust_level": "unofficial",
        "notes": "Fan-Community"
      }
    ],
    "daten_nachschlagen": [
      {
        "url": "https://www.transfermarkt.de/1-fc-nurnberg/startseite/verein/42",
        "name": "Transfermarkt Profil",
        "category": "stats",
        "source_type": "transfer-data",
        "trust_level": "trusted-third-party",
        "notes": null
      }
    ],
    "medien_berichterstattung": [
      {
        "url": "https://www.nn.de/sport/1-fc-nuernberg",
        "name": "Nürnberger Nachrichten (FCN)",
        "category": "media",
        "source_type": "local-media",
        "trust_level": "trusted-third-party",
        "notes": null
      }
    ],
    "stadion_matchday": [
      {
        "url": "https://www.fcn.de/der-club/stadion/anreise",
        "name": "Anreise Max-Morlock-Stadion",
        "category": "stadium",
        "source_type": "travel-info",
        "trust_level": "official",
        "notes": null
      }
    ],
    "metadaten": {
      "last_checked": "2026-04-09T02:33:00Z",
      "confidence": 1.0,
      "notes": "Daten für Batch 2 aktualisiert.",
      "missing_fields": [],
      "update_priority": "medium"
    }
}