{
    "basisdaten": {
      "id": "1-fsv-mainz-05",
      "slug": "1-fsv-mainz-05",
      "name": "1. FSV Mainz 05",
      "short_name": "Mainz 05",
      "sport": "fussball",
      "country": "deutschland",
      "league": "bundesliga",
      "city": "Mainz",
      "federal_state": "Rheinland-Pfalz",
      "stadium_name": "MEWA ARENA",
      "stadium_location": "Eugen-Salomon-Straße 1, 55128 Mainz",
      "stadium_capacity": 33305,
      "primary_colors_text": "Rot, Weiß"
    },
    "offizielle_quellen": [
      {
        "url": "https://www.mainz05.de",
        "name": "Offizielle Website",
        "category": "official",
        "source_type": "official-club-site",
        "trust_level": "official",
        "notes": null
      },
      {
        "url": "https://shop.mainz05.de",
        "name": "Fanshop",
        "category": "official",
        "source_type": "official-fanshop",
        "trust_level": "official",
        "notes": null
      },
      {
        "url": "https://www.instagram.com/mainz05fussball",
        "name": "Instagram",
        "category": "official",
        "source_type": "official-social",
        "trust_level": "official",
        "notes": null
      }
    ],
    "inoffizielle_quellen": [
      {
        "url": "https://www.mainz1905.de",
        "name": "Nur der FSV!",
        "category": "fan",
        "source_type": "fan-forum",
        "trust_level": "unofficial",
        "notes": "Fan-Forum"
      }
    ],
    "daten_nachschlagen": [
      {
        "url": "https://www.transfermarkt.de/1-fsv-mainz-05/startseite/verein/39",
        "name": "Transfermarkt Profil",
        "category": "stats",
        "source_type": "transfer-data",
        "trust_level": "trusted-third-party",
        "notes": null
      }
    ],
    "medien_berichterstattung": [
      {
        "url": "https://www.allgemeine-zeitung.de/sport/fussball/mainz-05",
        "name": "Allgemeine Zeitung (Mainz 05)",
        "category": "media",
        "source_type": "local-media",
        "trust_level": "trusted-third-party",
        "notes": null
      }
    ],
    "stadion_matchday": [
      {
        "url": "https://www.mainz05.de/stadion/mewa-arena/anreise",
        "name": "Anreise MEWA ARENA",
        "category": "stadium",
        "source_type": "travel-info",
        "trust_level": "official",
        "notes": null
      }
    ],
    "metadaten": {
      "last_checked": "2026-04-09T02:21:00Z",
      "confidence": 1.0,
      "notes": "Daten für Batch 1 aktualisiert.",
      "missing_fields": [],
      "update_priority": "medium"
    }
}