{
  "basisdaten": {
    "id": "fc-st-pauli",
    "slug": "fc-st-pauli",
    "name": "FC St. Pauli",
    "short_name": "St. Pauli",
    "sport": "fussball",
    "country": "deutschland",
    "league": "bundesliga",
    "city": "Hamburg",
    "federal_state": "Hamburg",
    "stadium_name": "Millerntor-Stadion",
    "stadium_location": "Harald-Stender-Platz 1, 20359 Hamburg",
    "stadium_capacity": 29546,
    "primary_colors_text": "Braun, Weiß"
  },
  "offizielle_quellen": [
    {
      "url": "https://www.fcstpauli.com",
      "name": "Offizielle Website",
      "category": "official",
      "source_type": "official-club-site",
      "trust_level": "official",
      "notes": null
    },
    {
      "url": "https://www.fcsp-shop.com",
      "name": "Fanshop",
      "category": "official",
      "source_type": "official-fanshop",
      "trust_level": "official",
      "notes": null
    },
    {
      "url": "https://www.instagram.com/fcstpauli",
      "name": "Instagram",
      "category": "official",
      "source_type": "official-social",
      "trust_level": "official",
      "notes": null
    }
  ],
  "inoffizielle_quellen": [
    {
      "url": "https://www.millernton.de",
      "name": "MillernTon",
      "category": "fan",
      "source_type": "fan-blog",
      "trust_level": "unofficial",
      "notes": "Blog und Podcast"
    }
  ],
  "daten_nachschlagen": [
    {
      "url": "https://www.transfermarkt.de/fc-st-pauli/startseite/verein/35",
      "name": "Transfermarkt Profil",
      "category": "stats",
      "source_type": "transfer-data",
      "trust_level": "trusted-third-party",
      "notes": null
    }
  ],
  "medien_berichterstattung": [
    {
      "url": "https://www.mopo.de/sport/fc-st-pauli",
      "name": "Hamburger Morgenpost (FCSP)",
      "category": "media",
      "source_type": "local-media",
      "trust_level": "trusted-third-party",
      "notes": null
    }
  ],
  "stadion_matchday": [
    {
      "url": "https://www.google.com/maps/search/?api=1&query=Millerntor-Stadion",
      "name": "Anfahrt (Google Maps)",
      "category": "stadium",
      "source_type": "travel-info",
      "trust_level": "official",
      "notes": null
    }
  ],
  "metadaten": {
    "last_checked": "2026-04-09T02:23:00Z",
    "confidence": 1,
    "notes": "Daten für Batch 1 aktualisiert.",
    "missing_fields": [],
    "update_priority": "medium"
  }
}