{
    "basisdaten": {
      "id": "1-fc-kaiserslautern",
      "slug": "1-fc-kaiserslautern",
      "name": "1. FC Kaiserslautern",
      "short_name": "Lautern",
      "sport": "fussball",
      "country": "deutschland",
      "league": "zweite-bundesliga",
      "city": "Kaiserslautern",
      "federal_state": "Rheinland-Pfalz",
      "stadium_name": "Fritz-Walter-Stadion",
      "stadium_location": "Fritz-Walter-Straße 1, 67663 Kaiserslautern",
      "stadium_capacity": 49850,
      "primary_colors_text": "Rot, Weiß"
    },
    "offizielle_quellen": [
      {
        "url": "https://fck.de",
        "name": "Offizielle Website",
        "category": "official",
        "source_type": "official-club-site",
        "trust_level": "official",
        "notes": null
      },
      {
        "url": "https://shop.fck.de",
        "name": "FCK Fanshop",
        "category": "official",
        "source_type": "official-fanshop",
        "trust_level": "official",
        "notes": null
      },
      {
        "url": "https://www.instagram.com/1fckaiserslautern",
        "name": "Instagram",
        "category": "official",
        "source_type": "official-social",
        "trust_level": "official",
        "notes": null
      }
    ],
    "inoffizielle_quellen": [
      {
        "url": "https://www.treffpunkt-betze.de",
        "name": "Treffpunkt Betze",
        "category": "fan",
        "source_type": "fan-forum",
        "trust_level": "unofficial",
        "notes": "Fan-Zentrale"
      },
      {
        "url": "https://www.der-betze-brennt.de",
        "name": "Der Betze brennt",
        "category": "fan",
        "source_type": "fan-magazine",
        "trust_level": "unofficial",
        "notes": "Fan-Plattform"
      }
    ],
    "daten_nachschlagen": [
      {
        "url": "https://www.transfermarkt.de/1-fc-kaiserslautern/startseite/verein/2",
        "name": "Transfermarkt Profil",
        "category": "stats",
        "source_type": "transfer-data",
        "trust_level": "trusted-third-party",
        "notes": null
      }
    ],
    "medien_berichterstattung": [
      {
        "url": "https://www.rheinpfalz.de/fck",
        "name": "Die Rheinpfalz (FCK)",
        "category": "media",
        "source_type": "local-media",
        "trust_level": "trusted-third-party",
        "notes": null
      }
    ],
    "stadion_matchday": [
      {
        "url": "https://fck.de/de/stadion/anfahrt",
        "name": "Anfahrt Fritz-Walter-Stadion",
        "category": "stadium",
        "source_type": "travel-info",
        "trust_level": "official",
        "notes": null
      }
    ],
    "metadaten": {
      "last_checked": "2026-04-09T02:35:00Z",
      "confidence": 1.0,
      "notes": "Daten für Batch 2 aktualisiert.",
      "missing_fields": [],
      "update_priority": "medium"
    }
}