{
  "basisdaten": {
    "id": "sv-waldhof-mannheim",
    "slug": "sv-waldhof-mannheim",
    "name": "SV Waldhof Mannheim 07",
    "short_name": "Waldhof",
    "sport": "fussball",
    "country": "deutschland",
    "league": "dritte-liga",
    "city": "Mannheim",
    "federal_state": "Baden-Württemberg",
    "stadium_name": "Carl-Benz-Stadion",
    "stadium_location": "Theodor-Heuss-Anlage 20, 68165 Mannheim",
    "stadium_capacity": 24302,
    "primary_colors_text": "Blau, Schwarz"
  },
  "offizielle_quellen": [
    {
      "url": "https://www.svw07.de",
      "name": "Offizielle Website",
      "category": "official",
      "source_type": "official-club-site",
      "trust_level": "official",
      "notes": null
    },
    {
      "url": "https://www.shop.svw07.de/",
      "name": "Waldhof Fanshop",
      "category": "official",
      "source_type": "official-fanshop",
      "trust_level": "official",
      "notes": null
    },
    {
      "url": "https://www.instagram.com/svw07_official",
      "name": "Instagram",
      "category": "official",
      "source_type": "official-social",
      "trust_level": "official",
      "notes": null
    }
  ],
  "inoffizielle_quellen": [
    {
      "url": "https://www.waldhof-forum.de",
      "name": "Waldhof-Forum",
      "category": "fan",
      "source_type": "fan-forum",
      "trust_level": "unofficial",
      "notes": "Traditionsreicher Fantreff"
    },
    {
      "url": "https://www.pro-waldhof.de",
      "name": "PRO Waldhof",
      "category": "fan",
      "source_type": "fan-portal",
      "trust_level": "unofficial",
      "notes": "Fan-Dachverband"
    }
  ],
  "daten_nachschlagen": [
    {
      "url": "https://www.transfermarkt.de/sv-waldhof-mannheim/startseite/verein/157",
      "name": "Transfermarkt Profil",
      "category": "stats",
      "source_type": "transfer-data",
      "trust_level": "trusted-third-party",
      "notes": null
    }
  ],
  "medien_berichterstattung": [
    {
      "url": "https://news.google.com/search?q=SV%20Waldhof%20Mannheim%2007",
      "name": "Google News (SV Waldhof Mannheim 07)",
      "category": "media",
      "source_type": "local-media",
      "trust_level": "trusted-third-party",
      "notes": null
    }
  ],
  "stadion_matchday": [
    {
      "url": "https://www.svw07.de/stadion/ruhrstadion/anreise",
      "name": "Anreise Carl-Benz-Stadion",
      "category": "stadium",
      "source_type": "travel-info",
      "trust_level": "official",
      "notes": null
    }
  ],
  "metadaten": {
    "last_checked": "2026-04-09T03:40:00Z",
    "confidence": 1,
    "notes": "Daten für Batch 3 aktualisiert.",
    "missing_fields": [],
    "update_priority": "medium"
  }
}