{
  "basisdaten": {
    "id": "sc-verl",
    "slug": "sc-verl",
    "name": "Sportclub Verl",
    "short_name": "SCV",
    "sport": "fussball",
    "country": "deutschland",
    "league": "dritte-liga",
    "city": "Verl",
    "federal_state": "Nordrhein-Westfalen",
    "stadium_name": "SPORTCLUB Arena",
    "stadium_location": "Sender Straße 36, 33415 Verl",
    "stadium_capacity": 5153,
    "primary_colors_text": "Schwarz, Weiß"
  },
  "offizielle_quellen": [
    {
      "url": "https://www.sportclub-verl.de",
      "name": "Offizielle Website",
      "category": "official",
      "source_type": "official-club-site",
      "trust_level": "official",
      "notes": null
    },
    {
      "url": "https://www.sportclub-verl.de/fans/onlineshop",
      "name": "Fanshop",
      "category": "official",
      "source_type": "official-fanshop",
      "trust_level": "official",
      "notes": null
    },
    {
      "url": "https://www.instagram.com/sportclubverl",
      "name": "Instagram",
      "category": "official",
      "source_type": "official-social",
      "trust_level": "official",
      "notes": null
    }
  ],
  "inoffizielle_quellen": [
    {
      "url": "http://www.scv-fans.de",
      "name": "SCV-Fans",
      "category": "fan",
      "source_type": "fan-forum",
      "trust_level": "unofficial",
      "notes": "Fan-Forum"
    }
  ],
  "daten_nachschlagen": [
    {
      "url": "https://www.transfermarkt.de/sc-verl/startseite/verein/135",
      "name": "Transfermarkt Profil",
      "category": "stats",
      "source_type": "transfer-data",
      "trust_level": "trusted-third-party",
      "notes": null
    }
  ],
  "medien_berichterstattung": [
    {
      "url": "https://www.die-glocke.de/sport/lokalsport/verl",
      "name": "Die Glocke (Verl)",
      "category": "media",
      "source_type": "local-media",
      "trust_level": "trusted-third-party",
      "notes": null
    }
  ],
  "stadion_matchday": [
    {
      "url": "https://www.google.com/maps/search/?api=1&query=SPORTCLUB%20Arena",
      "name": "Anfahrt (Google Maps)",
      "category": "stadium",
      "source_type": "travel-info",
      "trust_level": "official",
      "notes": null
    }
  ],
  "metadaten": {
    "last_checked": "2026-04-09T03:50:00Z",
    "confidence": 1,
    "notes": "Daten für Batch 3 aktualisiert.",
    "missing_fields": [],
    "update_priority": "medium"
  }
}