{
    "basisdaten": {
      "id": "bayer-04-leverkusen",
      "slug": "bayer-04-leverkusen",
      "name": "Bayer 04 Leverkusen",
      "short_name": "Bayer 04",
      "sport": "fussball",
      "country": "deutschland",
      "league": "bundesliga",
      "city": "Leverkusen",
      "federal_state": "Nordrhein-Westfalen",
      "stadium_name": "BayArena",
      "stadium_location": "Bismarckstraße 122-124, 51373 Leverkusen",
      "stadium_capacity": 30210,
      "primary_colors_text": "Schwarz, Rot"
    },
    "offizielle_quellen": [
      {
        "url": "https://www.bayer04.de",
        "name": "Offizielle Website",
        "category": "official",
        "source_type": "official-club-site",
        "trust_level": "official",
        "notes": null
      },
      {
        "url": "https://shop.bayer04.de",
        "name": "Fanshop",
        "category": "official",
        "source_type": "official-fanshop",
        "trust_level": "official",
        "notes": null
      },
      {
        "url": "https://www.instagram.com/bayer04fussball",
        "name": "Instagram",
        "category": "official",
        "source_type": "official-social",
        "trust_level": "official",
        "notes": null
      }
    ],
    "inoffizielle_quellen": [
      {
        "url": "https://www.werkself.de",
        "name": "Werkself.de",
        "category": "fan",
        "source_type": "fan-forum",
        "trust_level": "unofficial",
        "notes": "Zentrales Fan-Forum"
      }
    ],
    "daten_nachschlagen": [
      {
        "url": "https://www.transfermarkt.de/bayer-04-leverkusen/startseite/verein/15",
        "name": "Transfermarkt Profil",
        "category": "stats",
        "source_type": "transfer-data",
        "trust_level": "trusted-third-party",
        "notes": null
      }
    ],
    "medien_berichterstattung": [
      {
        "url": "https://www.rp-online.de/sport/fussball/bayer-leverkusen",
        "name": "Rheinische Post (Bayer Leverkusen)",
        "category": "media",
        "source_type": "local-media",
        "trust_level": "trusted-third-party",
        "notes": null
      }
    ],
    "stadion_matchday": [
      {
        "url": "https://www.bayer04.de/de-de/page/bayarena/anreise-und-parken",
        "name": "Anreise & Parken",
        "category": "stadium",
        "source_type": "travel-info",
        "trust_level": "official",
        "notes": null
      }
    ],
    "metadaten": {
      "last_checked": "2026-04-09T02:18:00Z",
      "confidence": 1.0,
      "notes": "Daten für Batch 1 aktualisiert.",
      "missing_fields": [],
      "update_priority": "medium"
    }
}