{
    "basisdaten": {
      "id": "eintracht-frankfurt",
      "slug": "eintracht-frankfurt",
      "name": "Eintracht Frankfurt",
      "short_name": "Eintracht",
      "sport": "fussball",
      "country": "deutschland",
      "league": "bundesliga",
      "city": "Frankfurt am Main",
      "federal_state": "Hessen",
      "stadium_name": "Deutsche Bank Park",
      "stadium_location": "Mörfelder Landstraße 362, 60528 Frankfurt am Main",
      "stadium_capacity": 58000,
      "primary_colors_text": "Schwarz, Rot, Weiß"
    },
    "offizielle_quellen": [
      {
        "url": "https://www.eintracht.de",
        "name": "Offizielle Website",
        "category": "official",
        "source_type": "official-club-site",
        "trust_level": "official",
        "notes": null
      },
      {
        "url": "https://shop.eintracht.de",
        "name": "Eintracht Fanshop",
        "category": "official",
        "source_type": "official-fanshop",
        "trust_level": "official",
        "notes": null
      },
      {
        "url": "https://www.instagram.com/eintrachtfrankfurt",
        "name": "Instagram",
        "category": "official",
        "source_type": "official-social",
        "trust_level": "official",
        "notes": null
      }
    ],
    "inoffizielle_quellen": [
      {
        "url": "https://www.sge4ever.de",
        "name": "SGE4ever.de",
        "category": "fan",
        "source_type": "fan-blog",
        "trust_level": "unofficial",
        "notes": "Online-Magazin"
      },
      {
        "url": "https://community.eintracht.de/forum",
        "name": "Eintracht-Forum",
        "category": "fan",
        "source_type": "fan-forum",
        "trust_level": "unofficial",
        "notes": "Große Fan-Community"
      }
    ],
    "daten_nachschlagen": [
      {
        "url": "https://www.transfermarkt.de/eintracht-frankfurt/startseite/verein/24",
        "name": "Transfermarkt Profil",
        "category": "stats",
        "source_type": "transfer-data",
        "trust_level": "trusted-third-party",
        "notes": null
      }
    ],
    "medien_berichterstattung": [
      {
        "url": "https://www.hessenschau.de/sport/fussball/eintracht-frankfurt",
        "name": "Hessenschau (Eintracht)",
        "category": "media",
        "source_type": "local-media",
        "trust_level": "trusted-third-party",
        "notes": null
      }
    ],
    "stadion_matchday": [
      {
        "url": "https://www.deutschebankpark.de/anfahrt",
        "name": "Anfahrt Deutsche Bank Park",
        "category": "stadium",
        "source_type": "travel-info",
        "trust_level": "official",
        "notes": null
      }
    ],
    "metadaten": {
      "last_checked": "2026-04-09T02:19:00Z",
      "confidence": 1.0,
      "notes": "Daten für Batch 1 aktualisiert.",
      "missing_fields": [],
      "update_priority": "medium"
    }
}